<?xml version="1.0" encoding="UTF-8"?>
<L2A_Quality_File xmlns:xsi="http://www.w3.org/2001/XMLSchema-instance"
				  xmlns="http://gs2.esa.int/DATA_STRUCTURE/l2aqiReport"
				  xsi:schemaLocation="http://gs2.esa.int/DATA_STRUCTURE/l2aqiReport L2A_QUALITY.xsd">
	<L2A_Quality_Header>
		<Fixed_Header>
			<File_Name>L2A_QUALITY</File_Name>
			<File_Description>Quality information obtained from Sen2Cor</File_Description>
			<Notes/>
			<Mission>S2A</Mission>
			<!-- This can be set to OPER or USER dependent on PDGS or Toolbox mode -->
			<File_Class>USER</File_Class>
			<File_Type>L2A_QLINFO</File_Type>
			<Validity_Period>
                <Validity_Start>UTC=2015-06-22T00:00:00</Validity_Start>
                <Validity_Stop>UTC=2100-01-01T00:00:00</Validity_Stop>
			</Validity_Period>
			<File_Version>1</File_Version>
			<Source>
				<System>Sen2Cor</System>
				<Creator>Sen2Cor</Creator>
				<Creator_Version>2.10</Creator_Version>
				<Creation_Date>UTC=0000-00-00T00:00:00</Creation_Date>
			</Source>
		</Fixed_Header>
	</L2A_Quality_Header>
	<Data_Block type="xml">
		<report gippVersion="1.0" globalStatus="PASSED" date="2001-12-17T09:30:47Z">
			<checkList>
				<parentID>L2A_SC</parentID>
				<name>SCENE_CLASS_QUALITY</name>
				<version>2.10</version>
				<item class="http://www.esa.int/s2#pdi_level_2a_tile_container"
					  className="PDI Level 2A Tile Folder"
					  name="NA"
					  url="NA"
				/>
				<check>
					<message contentType="text/plain">"Percentage of classified pixels"</message>
					<extraValues>
						<value name="CLOUDY_PIXEL_PERCENTAGE">NA</value>
						<value name="CLOUDY_PIXEL_OVER_LAND_PERCENTAGE">NA</value>
						<value name="DEGRADED_MSI_DATA_PERCENTAGE">NA</value>
						<value name="NODATA_PIXEL_PERCENTAGE">NA</value>
						<value name="SATURATED_DEFECTIVE_PIXEL_PERCENTAGE">NA</value>
						<value name="CAST_SHADOW_PERCENTAGE">NA</value>
						<value name="CLOUD_SHADOW_PERCENTAGE">NA</value>
						<value name="VEGETATION_PERCENTAGE">NA</value>
						<value name="NOT_VEGETATED_PERCENTAGE">NA</value>
						<value name="WATER_PERCENTAGE">NA</value>
						<value name="UNCLASSIFIED_PERCENTAGE">NA</value>
						<value name="MEDIUM_PROBA_CLOUDS_PERCENTAGE">NA</value>
						<value name="HIGH_PROBA_CLOUDS_PERCENTAGE">NA</value>
						<value name="THIN_CIRRUS_PERCENTAGE">NA</value>
						<value name="SNOW_ICE_PERCENTAGE">NA</value>
					</extraValues>
				</check>
			</checkList>
			<checkList>
				<parentID>L2A_AC</parentID>
				<name>ATMOSPHERIC_CORRECTION_QUALITY</name>
				<version>2.10</version>
				<item class="http://www.esa.int/s2#pdi_level_2a_tile_container"
					  className="PDI Level 2A Tile Folder"
					  name="NA"
					  url="NA"
				/>
				<check>
					<message contentType="text/plain">Atmospheric correction quality values</message>
					<extraValues>
						<value name="AOT_RETRIEVAL_ACCURACY">NA</value>
						<value name="GRANULE_MEAN_AOT">NA</value>
						<value name="WV_RETRIEVAL_ACCURACY">NA</value>
						<value name="GRANULE_MEAN_WV">NA</value>
						<value name="OZONE_VALUE">NA</value>
						<value name="START_VISIBILITY_KM">NA</value>
						<value name="VISIBILITY_FROM_DDV_KM">NA</value>
						<value name="FINAL_VISIBILITY_KM">NA</value>
						<value name="AVERAGE_SOLAR_ZENITH_ANGLE">NA</value>
						<value name="DDV_PIXEL_PERCENTAGE">NA</value>
						<value name="DDV_REFLECTANCE_RANGE">NA</value>
						<value name="BLUE_PATH_RADIANCE_RESCALING_FACTOR">NA</value>
					</extraValues>
				</check>
				<check>
					<message contentType="text/plain">Atmospheric correction quality control</message>
					<extraValues>
						<value name="AC_ENABLED">True</value>
						<!-- WV_RETRIEVAL_METHOD: SEN2COR_APDA | NA -->
						<value name="WV_RETRIEVAL_METHOD">SEN2COR_APDA</value>
						<!-- AOT_RETRIEVAL_METHOD: SEN2COR_DDV | CAMS | DEFAULT | NA-->
						<value name="AOT_RETRIEVAL_METHOD">NA</value>
						<value name="VISIBILITY_LESS_THAN_5_KM">NA</value>
						<value name="AOT_ABOVE_1">NA</value>
						<value name="GRANULE_WV_ABOVE_5_CM">NA</value>
					</extraValues>
				</check>
				<check>
					<message contentType="text/plain">Percentage of negative BOA pixels</message>
					<extraValues>
						<value name="B01">NA</value>
						<value name="B02">NA</value>
						<value name="B03">NA</value>
						<value name="B04">NA</value>
						<value name="B05">NA</value>
						<value name="B06">NA</value>
						<value name="B07">NA</value>
						<value name="B08">NA</value>
						<value name="B8A">NA</value>
						<value name="B11">NA</value>
						<value name="B12">NA</value>
					</extraValues>
				</check>
				<check>
					<message contentType="text/plain">Look up table file list</message>
					<extraValues>
						<value name="LUT_DATA_FILES">NA</value>
					</extraValues>
				</check>
			</checkList>
			<checkList>
				<parentID>L2A_AUX</parentID>
				<name>AUX_DATA_QUALITY</name>
				<version>2.10</version>
				<item class="http://www.esa.int/s2#pdi_level_2a_tile_container"
					  className="PDI Level 2A Tile Folder"
					  name="NA"
					  url="NA"
				/>				
				<check>
					<message contentType="text/plain">AUX related parameters</message>
					<extraValues>
						<!-- DEM_TYPE: SRTM_90 | DTED_90 | DTED_30 | (CDSE-AWS) COPERNICUS_90 | (CDSE-AWS) COPERNICUS_30 -->
						<value name="DEM_TYPE">NA</value>
						<value name="DEM_MEAN_ALTITUDE_KM">NA</value>
						<value name="DEM_MEAN_SLOPE">NA</value>
						<value name="GROUND_ELEVATION_ABOVE_3_KM">NA</value>
						<value name="SOLAR_ZENITH_ANGLE_ABOVE_70_DEG">NA</value>
						<!-- OZONE_SOURCE: AUX_ECMWFT | CONFIG | CAMS | OTHER  -->
						<value name="OZONE_SOURCE">NA</value>
					</extraValues>
				</check>
				<check>
					<message contentType="text/plain">AUX data file list</message>
					<extraValues>
						<value name="AUX_DATA_FILES">Available</value>
					</extraValues>
				</check>
			</checkList>
		</report>
	</Data_Block>
</L2A_Quality_File>
